Cites,Authors,Title,Year,Source,Publisher,ArticleURL,CitesURL,GSRank,QueryDate,Type,DOI,ISSN,CitationURL,Volume,Issue,StartPage,EndPage,ECC,CitesPerYear,CitesPerAuthor,AuthorCount,Age,Abstract,FullTextURL,RelatedURL
3,"M Mahn, I Saraf-Sinik, P Patil, M Pulin, E Bitton…","Optogenetic silencing of neurotransmitter release with a naturally occurring invertebrate rhodopsin",2021,"bioRxiv","biorxiv.org","https://www.biorxiv.org/content/10.1101/2021.02.18.431673.abstract","https://scholar.google.com/scholar?cites=14392801267193955714&as_sdt=2005&sciodt=2007&hl=en",522,"2024-02-14 17:48:04","","10.1101/2021.02.18.431673.abstract","","",,,,,3,1.00,1,6,3,"… Briefly, we trained DLC to detect 6 features on the mouse body (nose, head center, left and right ears, center of mass, tail) and 3 bottom corners of the arena. XY coordinates of each …","https://www.biorxiv.org/content/10.1101/2021.02.18.431673.full.pdf","https://scholar.google.com/scholar?q=related:gkXjBX-AvccJ:scholar.google.com/&scioq=deeplabcut+dlc&hl=en&as_sdt=2007"
0,"SMD Cheng","PalmGrid, an artificial intelligence approach to automate cylinder task detection",2019,"","open.library.ubc.ca","https://open.library.ubc.ca/soa/cIRcle/collections/ubctheses/24/items/1.0378469","",523,"2024-02-14 17:48:04","","","","",,,,,0,0.00,0,1,5,"… Given the fact that we are stretching resolution capabilities of DeepLabCut, forelimb recognition of free and fast-moving mice is also of interests. It would be easier to set camera focus to …","https://open.library.ubc.ca/media/download/pdf/24/1.0378469/4","https://scholar.google.com/scholar?q=related:e-mAQuq36mMJ:scholar.google.com/&scioq=deeplabcut+dlc&hl=en&as_sdt=2007"
4,"M Jayachandran, TD Viena, A Garcia, AV Veliz…","Reuniens transiently synchronizes memory networks at beta frequencies",2022,"BioRxiv","biorxiv.org","https://www.biorxiv.org/content/10.1101/2022.06.21.497087.abstract","https://scholar.google.com/scholar?cites=15662635401995001514&as_sdt=2005&sciodt=2007&hl=en",524,"2024-02-14 17:48:04","","10.1101/2022.06.21.497087.abstract","","",,,,,4,2.00,1,5,2,"… our analyses into three behavioral states: (1) memory (sequence trials), (2) running, and (3) stationary periods using an open-source machine learning tracking algorithm (DeepLabCut). …","https://www.biorxiv.org/content/10.1101/2022.06.21.497087.full.pdf","https://scholar.google.com/scholar?q=related:qp5e9unbXNkJ:scholar.google.com/&scioq=deeplabcut+dlc&hl=en&as_sdt=2007"
0,"R Uitto","Deep learning in gait analysis: the effect of marker presence in neural network training to kinematic outcomes",2021,"","jyx.jyu.fi","https://jyx.jyu.fi/handle/123456789/77355","",525,"2024-02-14 17:48:04","","","","",,,,,0,0.00,0,1,3,"… were able to reach human-level labelling accuracy with DeepLabCut using only ~200 … results from DeepLabCut and Vicon as similarly as possible, 3D coordinates of the previously …","https://jyx.jyu.fi/bitstream/handle/123456789/77355/URN%3ANBN%3Afi%3Ajyu-202108124521.pdf?sequence=1","https://scholar.google.com/scholar?q=related:Z9knENLwT-QJ:scholar.google.com/&scioq=deeplabcut+dlc&hl=en&as_sdt=2007"
0,"S Keshavarzi, E Bracey, R Faville…","Multi-Sensory Coding of Head Velocity in the Retrosplenial Cortex During Navigation",,"Available at SSRN …","papers.ssrn.com","https://papers.ssrn.com/sol3/papers.cfm?abstract_id=3821958","",526,"2024-02-14 17:48:04","","","","",,,,,0,0.00,0,4,,"… Pupil movements were then tracked offline using DeepLabCut (DLC, 80). A pre-trained ResNet-50 network was trained on 240 frames from 6 video recordings (40 frames from each) …","","https://scholar.google.com/scholar?q=related:A_eAzgTXJEMJ:scholar.google.com/&scioq=deeplabcut+dlc&hl=en&as_sdt=2007"
14,"R Mazziotti, F Carrara, A Viglione, L Lupori, LL Verde…","MEYE: web app for translational and real-time pupillometry",2021,"eneuro","eneuro.org","https://www.eneuro.org/content/8/5/ENEURO.0122-21.2021.abstract","https://scholar.google.com/scholar?cites=12476348935126909909&as_sdt=2005&sciodt=2007&hl=en",527,"2024-02-14 17:48:04","","","","",,,,,14,4.67,2,6,3,"… with the first stage of DeepLabCut, which implements an … segmentation networks used in DeepLabCut on our dataset. … higher dice coefficient) with respect to the DeepLabCut models. …","https://www.eneuro.org/content/8/5/ENEURO.0122-21.2021.full","https://scholar.google.com/scholar?q=related:1QMQBEHlJK0J:scholar.google.com/&scioq=deeplabcut+dlc&hl=en&as_sdt=2007"
0,"S Naeem, SA Ramay, MA Baloch, GJ Ansari…","Multi-Animal Recognition in Zoo Cluster using Deep Learning Technique",2023,"Journal of Computing & …","jcbi.org","https://www.jcbi.org/index.php/Main/article/view/108","",528,"2024-02-14 17:48:04","","","","",,,,,0,0.00,0,5,1,"… New Deep Lab Cut-Live! The package performs low latency actual time posture estimation (… This utility has three easy-touse options: DLC-Live! GUI and connection with Bonsai and …","https://www.jcbi.org/index.php/Main/article/download/108/67","https://scholar.google.com/scholar?q=related:b3rIBGNEd88J:scholar.google.com/&scioq=deeplabcut+dlc&hl=en&as_sdt=2007"
1,"A Farias Zuniga","Carpal Tunnel Pathomechanics: Vascular Dynamics, Tissue Kinematics, &Nerve Function",2020,"","macsphere.mcmaster.ca","https://macsphere.mcmaster.ca/handle/11375/25865","https://scholar.google.com/scholar?cites=13417336161244105462&as_sdt=2005&sciodt=2007&hl=en",529,"2024-02-14 17:48:04","","","","",,,,,1,0.25,1,1,4,"… Pearson product-moment correlation coefficients (r) and Root Mean Square Error (RMSE)(cm/s) results between DeepLabCut (DLC) and “dynamic” EchoPac tissue analysis of the flexor …","https://macsphere.mcmaster.ca/bitstream/11375/25865/2/FariasZuniga_Amanda_M_202009_doctorate.pdf","https://scholar.google.com/scholar?q=related:9kr1iib0M7oJ:scholar.google.com/&scioq=deeplabcut+dlc&hl=en&as_sdt=2007"
0,"D Berezhnoi, HD Chehade, H Chu","Open-Source Platform for Kinematic Analysis of Mouse Forelimb Movement",2024,"bioRxiv","biorxiv.org","https://www.biorxiv.org/content/10.1101/2024.01.31.578239.abstract","",530,"2024-02-14 17:48:04","","10.1101/2024.01.31.578239.abstract","","",,,,,0,0.00,0,3,1,"… acquired with DeepLabCut for two different views (use the *.h5 files generated by DLC) to … Note: The names for the points to track should be the same in both DeepLabCut files. If you …","https://www.biorxiv.org/content/10.1101/2024.01.31.578239.full.pdf","https://scholar.google.com/scholar?q=related:xTlGloHJBWYJ:scholar.google.com/&scioq=deeplabcut+dlc&hl=en&as_sdt=2007"
0,"A Ankita","Video analytics for lameness detection in dairy cattle: Effects of background removal and deep image matting on farm videos",2023,"","","","",531,"2024-02-14 17:48:04","CITATION","","","",,,,,0,0.00,0,1,1,"","","https://scholar.google.com/scholar?q=related:bcDHMpdy5bsJ:scholar.google.com/&scioq=deeplabcut+dlc&hl=en&as_sdt=2007"
0,"D Magaju","Fish passage design for Southern Hemisphere small-bodied fish: Hydrodynamic and behavioural assessment using spoiler baffles",2022,"","researchspace.auckland.ac.nz","https://researchspace.auckland.ac.nz/handle/2292/64428","",532,"2024-02-14 17:48:04","","","","",,,,,0,0.00,0,1,2,"… Figure 4-4 Errors between DLC and manually tracked frames for the three studied likelihood … Using DeepLabCut, we introduce and evaluate a machine learning based workflow to track …","https://researchspace.auckland.ac.nz/bitstream/handle/2292/64428/Magaju-2022-thesis.pdf?sequence=4&isAllowed=y","https://scholar.google.com/scholar?q=related:HW2g7EZZ9nQJ:scholar.google.com/&scioq=deeplabcut+dlc&hl=en&as_sdt=2007"
0,"D Germanese, S Colantonio, M Del Coco, P Carcagnì…","Computer Vision Tasks for Ambient Intelligence in Children's Health",2023,"Information","mdpi.com","https://www.mdpi.com/2078-2489/14/10/548","",533,"2024-02-14 17:48:04","HTML","","","",,,,,0,0.00,0,5,1,"… Another efficient deep architecture for markerless pose estimation and semantic features detection is DeepLabCut (DLC) [108]. Open source Python code for selecting training frames, …","https://www.mdpi.com/2078-2489/14/10/548","https://scholar.google.com/scholar?q=related:Y7MjfdiUFC8J:scholar.google.com/&scioq=deeplabcut+dlc&hl=en&as_sdt=2007"
0,"MJ Mykins","PHENOTYPING REGRESSION IN A FEMALE MOUSE MODEL FOR RETT SYNDROME USING COMPUTATIONAL NEUROETHOLOGY TOOLS",2023,"","trace.tennessee.edu","https://trace.tennessee.edu/utk_graddiss/8695/","",534,"2024-02-14 17:48:04","","","","",,,,,0,0.00,0,1,1,"… I would like to thank undergraduates Benjamin Bridges and Angela Jo for their help in creating, optimizing DLC model design, refining DLC pose estimation models, trimming videos for …","https://trace.tennessee.edu/cgi/viewcontent.cgi?article=9525&context=utk_graddiss","https://scholar.google.com/scholar?q=related:6HXoKL4d0eIJ:scholar.google.com/&scioq=deeplabcut+dlc&hl=en&as_sdt=2007"
0,"RH De Andrade Pedrosa","Spatiotemporal dynamic of the cortico-hippocampal interaction",2023,"","repository.ubn.ru.nl","https://repository.ubn.ru.nl/bitstream/handle/2066/289475/289475.pdf?sequence=1","",535,"2024-02-14 17:48:04","PDF","","","",,,,,0,0.00,0,1,1,"… We then used DeepLabCut [40] to label the pupil size detected in each behavioral imaging frame. From the high-movements of the circle centroid in the pupil, we obtained as saccade …","https://repository.ubn.ru.nl/bitstream/handle/2066/289475/289475.pdf?sequence=1","https://scholar.google.com/scholar?q=related:CKQQIE9DcNMJ:scholar.google.com/&scioq=deeplabcut+dlc&hl=en&as_sdt=2007"
2,"KD Harris, M Hunter, C Rossant, M Sasaki, S Shen…","Data architecture for a large-scale neuroscience collaboration",2019,"bioRxiv","biorxiv.org","https://www.biorxiv.org/content/biorxiv/early/2020/02/23/827873.full.pdf?%3Fcollection=","https://scholar.google.com/scholar?cites=640514467312386375&as_sdt=2005&sciodt=2007&hl=en",536,"2024-02-14 17:48:04","PDF","","","",,,,,2,0.40,0,6,5,"… Video is compressed using ​ffmpeg h264 codec (compression level crf 29)​, and tracking of body parts is performed with DeepLabCut​4​. Raw electrophysiology is compressed by a …","https://www.biorxiv.org/content/biorxiv/early/2020/02/23/827873.full.pdf?%3Fcollection=","https://scholar.google.com/scholar?q=related:R0GnsYOQ4wgJ:scholar.google.com/&scioq=deeplabcut+dlc&hl=en&as_sdt=2007"
0,"M Skrobot, R De Sa, J Walter, A Vogt, R Paulat, J Lips…","Refined movement analysis in the Staircase test reveals differential motor deficits in mouse models of stroke",2023,"bioRxiv","biorxiv.org","https://www.biorxiv.org/content/10.1101/2023.10.23.563529.abstract","",537,"2024-02-14 17:48:04","","10.1101/2023.10.23.563529.abstract","","",,,,,0,0.00,0,7,1,"… trajectory jumps that remained present in the DLC neural network despite optimized training. … four individual chambers and streamlined to the machine learning software, DeepLabCut, …","https://www.biorxiv.org/content/10.1101/2023.10.23.563529.full.pdf","https://scholar.google.com/scholar?q=related:TXqRRlwsyvEJ:scholar.google.com/&scioq=deeplabcut+dlc&hl=en&as_sdt=2007"
0,"V Süßle","Department of Natural Sciences and Mathematics &Information Science and Computer Science",2021,"","fbmn.h-da.de","https://fbmn.h-da.de/fileadmin/Dokumente/Studium/DS/WS2021_MDS_Thesis_Vanessa_Suessle_THE.pdf","",538,"2024-02-14 17:48:04","PDF","","","",,,,,0,0.00,0,1,3,"… The software package of DeepLabCut comes with an out of … the given neural network from DeepLabCut with its weights. In … DeepLabCut is is a deep convolutional neural network (CNN)…","https://fbmn.h-da.de/fileadmin/Dokumente/Studium/DS/WS2021_MDS_Thesis_Vanessa_Suessle_THE.pdf","https://scholar.google.com/scholar?q=related:lf5zSwThAQYJ:scholar.google.com/&scioq=deeplabcut+dlc&hl=en&as_sdt=2007"
0,"AK Garces","Analysis of Ion Channels in Planarian Behavior and Sensory Neuron Regeneration",2022,"","search.proquest.com","https://search.proquest.com/openview/171d1f50ed231ec71bb110b69ace8441/1?pq-origsite=gscholar&cbl=18750&diss=y","",539,"2024-02-14 17:48:04","","","","",,,,,0,0.00,0,1,2,"… of labels from the trainer and DLC. C: Heatmap depicting the … DeepLabCut™ can accurately detect differences between … data to determine if we use DeepLabCut™ for future analysis. …","","https://scholar.google.com/scholar?q=related:nIUJg1eMGYoJ:scholar.google.com/&scioq=deeplabcut+dlc&hl=en&as_sdt=2007"
0,"S Bowles, WR Williamson, D Nettles, J Hickman…","Closed-loop automated reaching apparatus (CLARA) for interrogating motor systems",2021,"bioRxiv","biorxiv.org","https://www.biorxiv.org/content/10.1101/2021.03.01.433419.abstract","",540,"2024-02-14 17:48:04","","10.1101/2021.03.01.433419.abstract","","",,,,,0,0.00,0,5,3,"… 5 frames from each camera are analyzed by a DLC network simultaneously … of DeepLabCut’s flexibility in how a network is trained. Prior to training a neural network using DeepLabCut, …","https://www.biorxiv.org/content/10.1101/2021.03.01.433419.full.pdf","https://scholar.google.com/scholar?q=related:H_gGXLxxqccJ:scholar.google.com/&scioq=deeplabcut+dlc&hl=en&as_sdt=2007"
0,"T Abe","The role of model implementation in neuroscientific applications of machine learning",2024,"","search.proquest.com","https://search.proquest.com/openview/34fd804eb5558e5720bc83d34ae79b8e/1?pq-origsite=gscholar&cbl=18750&diss=y","",541,"2024-02-14 17:48:04","","10.7916/789b-3934","","",,,,,0,0.00,0,1,1,"In modern neuroscience, large scale machine learning models are becoming increasingly critical components of data analysis. Despite the accelerating adoption of these large scale …","https://academiccommons.columbia.edu/doi/10.7916/789b-3934/download","https://scholar.google.com/scholar?q=related:QSSTFofTPHgJ:scholar.google.com/&scioq=deeplabcut+dlc&hl=en&as_sdt=2007"
0,"RVL Cruz","Effects of N, N-Dimethyltryptamine on the phenotype and diathesis of a mice model of depression",2023,"","repositorio.ufrn.br","https://repositorio.ufrn.br/handle/123456789/56775","",542,"2024-02-14 17:48:04","","","","",,,,,0,0.00,0,1,1,"Depression is a neurological disorder that affected 4.4% of the global population in 2017. It is characterized by apathy and anhedonia, which significantly impact the social and …","https://repositorio.ufrn.br/bitstream/123456789/56775/1/EffectsNNDimethyltryptamine_Cruz_2023.pdf","https://scholar.google.com/scholar?q=related:FvVJltgUNToJ:scholar.google.com/&scioq=deeplabcut+dlc&hl=en&as_sdt=2007"
27,"D Xiao, BJ Forys, MP Vanni, TH Murphy","MesoNet allows automated scaling and segmentation of mouse mesoscale cortical maps using machine learning",2021,"Nature communications","nature.com","https://www.nature.com/articles/s41467-021-26255-2","https://scholar.google.com/scholar?cites=1433412602669116123&as_sdt=2005&sciodt=2007&hl=en",543,"2024-02-14 17:48:04","HTML","","","",,,,,27,9.00,7,4,3,"… , and landmark estimation was done using DLC and then combined together to determine … Then, we used the labelled images to train a deep neural network (DeepLabCut) 25,62 with …","https://www.nature.com/articles/s41467-021-26255-2","https://scholar.google.com/scholar?q=related:2yqp5iqB5BMJ:scholar.google.com/&scioq=deeplabcut+dlc&hl=en&as_sdt=2007"
0,"LA Fournier, RA Phadke, M Salgado, A Brack…","Overexpression of the schizophrenia risk gene C4 in PV cells drives sex-dependent behavioral deficits and circuit dysfunction.",2024,"bioRxiv","biorxiv.org","https://www.biorxiv.org/content/10.1101/2024.01.27.575409.abstract","",544,"2024-02-14 17:48:04","","10.1101/2024.01.27.575409.abstract","","",,,,,0,0.00,0,5,1,"… ), mice and relevant behavioral arena components were tracked using DeepLabCut (DLC) (61). To ensure the accuracy of tracking by DLC, a random sampling of videos from each day …","https://www.biorxiv.org/content/10.1101/2024.01.27.575409.full.pdf","https://scholar.google.com/scholar?q=related:2vCI1l1Ae-YJ:scholar.google.com/&scioq=deeplabcut+dlc&hl=en&as_sdt=2007"
0,"W Wang, KW Kevin Tang, I Pyatnitskiy, X Liu, X Shi…","Ultrasound-Induced Cascade Amplification in a Mechanoluminescent Nanotransducer for Enhanced Sono-Optogenetic Deep Brain Stimulation",2023,"ACS …","ACS Publications","https://pubs.acs.org/doi/abs/10.1021/acsnano.3c06577","",545,"2024-02-14 17:48:04","","10.1021/acsnano.3c06577","","",,,,,0,0.00,0,6,1,"… The drug loading capacity (DLC) of IR780 and L012 in the … The DLC of CaO 2 in the liposomes was 2.8 wt % measured … recorded via camera and analyzed with DeeplabCut. (b) Blue …","","https://scholar.google.com/scholar?q=related:uknd-3lOyO8J:scholar.google.com/&scioq=deeplabcut+dlc&hl=en&as_sdt=2007"
3,"M Dawson, DJ Terstege, N Jamani, M Tsutsui…","Hypocretin/orexin neurons encode social discrimination and exhibit a sex-dependent necessity for social interaction",2023,"Cell Reports","cell.com","https://www.cell.com/cell-reports/pdf/S2211-1247(23)00826-4.pdf","https://scholar.google.com/scholar?cites=15713237226999065002&as_sdt=2005&sciodt=2007&hl=en",546,"2024-02-14 17:48:04","PDF","","","",,,,,3,3.00,1,5,1,"… Social behavior analysis We used the open-source automated positional tracking and behavioral classifications algorithms DeepLabCut (DLC)103 and Simple Behavior Analysis (…","https://www.cell.com/cell-reports/pdf/S2211-1247(23)00826-4.pdf","https://scholar.google.com/scholar?q=related:qim5cgGiENoJ:scholar.google.com/&scioq=deeplabcut+dlc&hl=en&as_sdt=2007"
0,"M Febo, R Mahar, NA Rodriguez, J Buraima…","Age-Related Differences in Emotional Behavior and Cognitive Function in Mice: Possible Role of Frontal Cortical-Hippocampal Functional Connectivity and …",2023,"bioRxiv","biorxiv.org","https://www.biorxiv.org/content/10.1101/2023.11.13.566691.abstract","",547,"2024-02-14 17:48:04","","10.1101/2023.11.13.566691.abstract","","",,,,,0,0.00,0,5,1,"… analyses were carried out using DeepLabCut (DLC, version 2.2.… DLC model. Conversely, the test dataset was used to evaluate the 182 performance of the model. We validated the DLC …","https://www.biorxiv.org/content/biorxiv/early/2023/12/15/2023.11.13.566691.full.pdf","https://scholar.google.com/scholar?q=related:VJX2YkInULwJ:scholar.google.com/&scioq=deeplabcut+dlc&hl=en&as_sdt=2007"
0,"D Kurup","Reward-based observational learning: Importance of social information and Anterior Cingulate Cortex for attention",2021,"","ntnuopen.ntnu.no","https://ntnuopen.ntnu.no/ntnu-xmlui/handle/11250/2829953","",548,"2024-02-14 17:48:04","","","","",,,,,0,0.00,0,1,3,"Observational learning is a natural behavior that is conserved from rodents to primates, yet the precise underlying neuronal substrate remains unclear. Neurodevelopmental disorders …","https://ntnuopen.ntnu.no/ntnu-xmlui/bitstream/handle/11250/2829953/no.ntnu:inspera:74872092:48112915.pdf?sequence=1","https://scholar.google.com/scholar?q=related:E_3PnhLSwj4J:scholar.google.com/&scioq=deeplabcut+dlc&hl=en&as_sdt=2007"
2,"J Talley, S Pusdekar, A Feltenberger, N Ketner, J Evers…","Predictive saccades and decision making in the beetle-predating saffron robber fly",2023,"Current Biology","cell.com","https://www.cell.com/current-biology/pdf/S0960-9822(23)00770-4.pdf","https://scholar.google.com/scholar?cites=11301797291946168097&as_sdt=2005&sciodt=2007&hl=en",549,"2024-02-14 17:48:04","PDF","","","",,,,,2,2.00,0,6,1,"… Analysis of behavior Deep Lab Cut for stimulus … Deep Lab Cut73 (DLC) within Python that was simulated in Anaconda3. High speed videos were then converted and run through DLC to …","https://www.cell.com/current-biology/pdf/S0960-9822(23)00770-4.pdf","https://scholar.google.com/scholar?q=related:IU_s7cEM2JwJ:scholar.google.com/&scioq=deeplabcut+dlc&hl=en&as_sdt=2007"
0,"C Bankar","OLD MOTOR CORTEX STROKE MODEL AND TASK-SPECIFIC IMAGE PROCESSING ALGORITHM TO DETECT VIDEO MOTION",2021,"","jscholarship.library.jhu.edu","https://jscholarship.library.jhu.edu/handle/1774.2/64192","",550,"2024-02-14 17:48:04","","","","",,,,,0,0.00,0,1,3,"… DeepLabCut parameters: The speed plots are a result of the wrist coordinates obtained from DeepLabCut analysis. However, DeepLabCut’s output depends on variables such as …","https://jscholarship.library.jhu.edu/bitstream/handle/1774.2/64192/BANKAR-THESIS-2021.pdf?sequence=1","https://scholar.google.com/scholar?q=related:rsnrpUb6P9cJ:scholar.google.com/&scioq=deeplabcut+dlc&hl=en&as_sdt=2007"
2,"CL Su, CC Cheng, PH Yen, JX Huang, YJ Ting…","Wireless neuromodulation in vitro and in vivo by intrinsic TRPC-mediated magnetomechanical stimulation",2022,"Communications …","nature.com","https://www.nature.com/articles/s42003-022-04124-y","https://scholar.google.com/scholar?cites=356497929011714055&as_sdt=2005&sciodt=2007&hl=en",551,"2024-02-14 17:48:04","HTML","","","",,,,,2,1.00,0,6,2,"… The previously reported DeepLabCut TM (DLC) 48 was used for tracking markless mice in the recorded behavioral videos. A custom-made python code was used for analyzing the …","https://www.nature.com/articles/s42003-022-04124-y","https://scholar.google.com/scholar?q=related:B9jnRfqI8gQJ:scholar.google.com/&scioq=deeplabcut+dlc&hl=en&as_sdt=2007"
0,"IL Barnard, TJ Onofrychuk, AD Toderash, VN Patel…","High-THC Cannabis smoke impairs incidental memory capacity in spontaneous tests of novelty preference for objects and odors in male rats",2023,"eneuro","eneuro.org","https://www.eneuro.org/content/10/12/ENEURO.0115-23.2023.abstract","",552,"2024-02-14 17:48:04","","","","",,,,,0,0.00,0,5,1,"… To train the DeepLabCut model, we … the DeepLabCut native median filter model. It is important to note that annotated training frames for this experiment were added to an existing DLC …","https://www.eneuro.org/content/10/12/ENEURO.0115-23.2023.full","https://scholar.google.com/scholar?q=related:5oI-wcxHzPwJ:scholar.google.com/&scioq=deeplabcut+dlc&hl=en&as_sdt=2007"
8,"M Marks, J Qiuhan, O Sturman, L von Ziegler…","SIPEC: the deep-learning Swiss knife for behavioral data analysis",2020,"…","research-collection.ethz.ch","https://www.research-collection.ethz.ch/handle/20.500.11850/451918","https://scholar.google.com/scholar?cites=6496053708269214978&as_sdt=2005&sciodt=2007&hl=en",553,"2024-02-14 17:48:04","","","","",,,,,8,2.00,2,5,4,"Analysing the behavior of individuals or groups of animals in complex environments is an important, yet difficult computer vision task. Here we present a novel deep learning …","https://www.research-collection.ethz.ch/bitstream/handle/20.500.11850/451918/2020.10.26.355115v1.full.pdf?sequence=1","https://scholar.google.com/scholar?q=related:At0-G26eJloJ:scholar.google.com/&scioq=deeplabcut+dlc&hl=en&as_sdt=2007"
0,"AM Lukose, A Gully, G Bailey","MARKERLESS TONGUE POSE ESTIMATION IN CROSS-LINGUISTIC SPOKEN AND MIMED SPEECH USING ULTRASOUND",,"guarant.cz","","https://guarant.cz/icphs2023/507.pdf","",554,"2024-02-14 17:48:04","PDF","","","",,,,,0,0.00,0,3,,"… DLC was first implemented on tongue and lip movements by Wrench and Balch-Tomes [23]. … Assistant Advanced version 219.08 [2], DLC is an innovative method for obtaining tongue …","https://guarant.cz/icphs2023/507.pdf","https://scholar.google.com/scholar?q=related:dmZMjcxDh1EJ:scholar.google.com/&scioq=deeplabcut+dlc&hl=en&as_sdt=2007"
4,"M Wilhelm, Y Sych, A Fomins…","Striatum-projecting prefrontal cortex neurons support working memory maintenance",2023,"Nature …","nature.com","https://www.nature.com/articles/s41467-023-42777-3","https://scholar.google.com/scholar?cites=4531340615501509076&as_sdt=2005&sciodt=2007&hl=en",555,"2024-02-14 17:48:04","HTML","","","",,,,,4,4.00,1,4,1,"… with DeepLabCut 66 (DLC). In every frame we estimated coordinates of the mouse’s nose, ears, and the tail-base. Next, from the coordinates of the mouse’s nose, ears, and tail base (…","https://www.nature.com/articles/s41467-023-42777-3","https://scholar.google.com/scholar?q=related:1HFEH0iO4j4J:scholar.google.com/&scioq=deeplabcut+dlc&hl=en&as_sdt=2007"
2,"CA Berger, AM Tarrant","Sensory conflict disrupts circadian rhythms in the sea anemone Nematostella vectensis",2023,"Elife","elifesciences.org","https://elifesciences.org/articles/81084","https://scholar.google.com/scholar?cites=5514636923817169370&as_sdt=2005&sciodt=2007&hl=en",556,"2024-02-14 17:48:04","","","","",,,,,2,2.00,1,2,1,"… Example of Nematostella vectensis locomotor behavior, with tracked center- point estimated by DeepLabCut. This video is sped up 200 x and covers a period of 100 min. Width of arena …","https://elifesciences.org/articles/81084.pdf","https://scholar.google.com/scholar?q=related:2hFgfRDth0wJ:scholar.google.com/&scioq=deeplabcut+dlc&hl=en&as_sdt=2007"
129,"AI Hsu, EA Yttri","B-SOiD, an open-source unsupervised algorithm for identification and fast prediction of behaviors",2021,"Nature communications","nature.com","https://www.nature.com/articles/s41467-021-25420-x","https://scholar.google.com/scholar?cites=16400265716433739217&as_sdt=2005&sciodt=2007&hl=en",557,"2024-02-14 17:48:04","HTML","","","",,,,,129,43.00,65,2,3,"… d Snapshot of behavioral state space aligned to a freely moving mouse(DeepLabCut), fruit fly(SLEAP), and the first author - taken with a cell phone camera(OpenPose). Informed …","https://www.nature.com/articles/s41467-021-25420-x","https://scholar.google.com/scholar?q=related:0d0M2sZymeMJ:scholar.google.com/&scioq=deeplabcut+dlc&hl=en&as_sdt=2007"
