Cites,Authors,Title,Year,Source,Publisher,ArticleURL,CitesURL,GSRank,QueryDate,Type,DOI,ISSN,CitationURL,Volume,Issue,StartPage,EndPage,ECC,CitesPerYear,CitesPerAuthor,AuthorCount,Age,Abstract,FullTextURL,RelatedURL
3,"D Yi, S Musall, A Churchland, N Padilla-Coreano…","Disentangled multi-subject and social behavioral representations through a constrained subspace variational autoencoder (CS-VAE)",2022,"bioRxiv","biorxiv.org","https://www.biorxiv.org/content/10.1101/2022.09.01.506091.abstract","https://scholar.google.com/scholar?cites=16041273161282918860&as_sdt=2005&sciodt=2007&hl=en",175,"2024-02-14 17:48:04","","10.1101/2022.09.01.506091.abstract","","",,,,,3,1.50,1,5,2,"… Related Works Pose estimation tools such as DeepLabCut (DLC) and LEAP have been … labels 55 generated using pose estimation methods such as DLC in order to partition the latent …","https://www.biorxiv.org/content/biorxiv/early/2023/05/04/2022.09.01.506091.full.pdf","https://scholar.google.com/scholar?q=related:zJlGK_MMnt4J:scholar.google.com/&scioq=deeplabcut+dlc&hl=en&as_sdt=2007"
2,"TL Sterley, N Cheng, JS Bains, K Murari","Markerless mouse tracking for social experiments",2024,"Eneuro","eneuro.org","https://www.eneuro.org/content/early/2024/01/11/ENEURO.0154-22.2023.abstract","https://scholar.google.com/scholar?cites=13912075464894922803&as_sdt=2005&sciodt=2007&hl=en",176,"2024-02-14 17:48:04","","","","",,,,,2,2.00,1,4,1,"… While any such technique can be used, we tried with DeepLabCut and SLEAP, and present … showed higher MOTA than SLEAP, we ensembled our results with DLC and this further …","https://www.eneuro.org/content/eneuro/early/2024/01/11/ENEURO.0154-22.2023.full.pdf","https://scholar.google.com/scholar?q=related:M0B9De2eEcEJ:scholar.google.com/&scioq=deeplabcut+dlc&hl=en&as_sdt=2007"
27,"H Liu, AR Reibman, JP Boerman","Video analytic system for detecting cow structure",2020,"Computers and Electronics in …","Elsevier","https://www.sciencedirect.com/science/article/pii/S0168169920303902","https://scholar.google.com/scholar?cites=6745204595588649665&as_sdt=2005&sciodt=2007&hl=en",177,"2024-02-14 17:48:04","","","","",,,,,27,6.75,9,3,4,"… One advantage of the DeepLabCut toolbox is that it provides … Later experiments show that the original DeepLabCut does … compared to the method in the DLC toolbox (first row). It can be …","https://engineering.purdue.edu/VADL/publications/He_cow_20.pdf","https://scholar.google.com/scholar?q=related:wdJkkdfHm10J:scholar.google.com/&scioq=deeplabcut+dlc&hl=en&as_sdt=2007"
8,"Y Jo, SM Lee, T Jung, G Park, C Lee, GH Im…","General‐Purpose Ultrasound Neuromodulation System for Chronic, Closed‐Loop Preclinical Studies in Freely Behaving Rodents",2022,"Advanced …","Wiley Online Library","https://onlinelibrary.wiley.com/doi/abs/10.1002/advs.202202345","https://scholar.google.com/scholar?cites=12212470735928131321&as_sdt=2005&sciodt=2007&hl=en",178,"2024-02-14 17:48:04","","10.1002/advs.202202345","","",,,,,8,4.00,1,7,2,"… The video data was analyzed offline using the widely used animal pose estimation program, DeepLabCut (DLC). [ 58 ] Our DLC workflow labeled each frame from 40 videos and used …","https://onlinelibrary.wiley.com/doi/pdf/10.1002/advs.202202345","https://scholar.google.com/scholar?q=related:-X7ZDG5pe6kJ:scholar.google.com/&scioq=deeplabcut+dlc&hl=en&as_sdt=2007"
0,"J Cáceres-Pajuelo, CA Alises…","SEX AND GONADAL HORMONES'INFLUENCE ON TRIGEMINAL MECHANICAL ALLODYNIA IN MICE",2023,"IBRO Neuroscience …","ibroneuroreports.org","https://www.ibroneuroreports.org/article/S2667-2421(23)01404-5/abstract","",179,"2024-02-14 17:48:04","","","","",,,,,0,0.00,0,3,1,"… Here, we apply DeeplabCut (DLC) to dissect mouse behavior on the thermal-plate test — a commonly used paradigm to ascertain supraspinal contributions to noxious thermal …","https://www.ibroneuroreports.org/article/S2667-2421(23)01404-5/pdf","https://scholar.google.com/scholar?q=related:7_ftDLR63McJ:scholar.google.com/&scioq=deeplabcut+dlc&hl=en&as_sdt=2007"
15,"N Rigney, A Zbib, GJ de Vries…","Knockdown of sexually differentiated vasopressin expression in the bed nucleus of the stria terminalis reduces social and sexual behaviour in male, but not female …",2022,"Journal of …","Wiley Online Library","https://onlinelibrary.wiley.com/doi/abs/10.1111/jne.13083","https://scholar.google.com/scholar?cites=2684490344662511704&as_sdt=2005&sciodt=2007&hl=en",180,"2024-02-14 17:48:04","","10.1111/jne.13083","","",,,,,15,7.50,4,4,2,"… 2.11 DeepLabCut and SimBA analysis Deeplabcut (DLC) 2.2b8 was used to track eight body points (… CSV files generated from DLC analysis and their corresponding videos were further …","https://onlinelibrary.wiley.com/doi/pdfdirect/10.1111/jne.13083","https://scholar.google.com/scholar?q=related:WDCT1L45QSUJ:scholar.google.com/&scioq=deeplabcut+dlc&hl=en&as_sdt=2007"
2,"F Plum, R Bulla, HK Beck, N Imirzian…","replicAnt: a pipeline for generating annotated images of animals in complex environments using Unreal Engine",2023,"Nature …","nature.com","https://www.nature.com/articles/s41467-023-42898-9","https://scholar.google.com/scholar?cites=14016246502759674650&as_sdt=2005&sciodt=2007&hl=en",181,"2024-02-14 17:48:04","HTML","","","",,,,,2,2.00,0,5,1,"… The synthetic dataset was then used to train a DeepLabCut 20 (DLC) pose estimator with a ResNet101 backbone. We emphasise that other excellent markerless pose estimators, such …","https://www.nature.com/articles/s41467-023-42898-9","https://scholar.google.com/scholar?q=related:GjNN2e61g8IJ:scholar.google.com/&scioq=deeplabcut+dlc&hl=en&as_sdt=2007"
0,"WS Kim, HM Woo, MI Khot, S Hong…","AI-Enabled High-Throughput Wireless Telemetry for Effective Photodynamic Therapy",2021,"2021 55th Asilomar …","ieeexplore.ieee.org","https://ieeexplore.ieee.org/abstract/document/9723372/","",182,"2024-02-14 17:48:04","","","","",,,,,0,0.00,0,5,3,"… original DLC python package does not support real-time processing, instead it only runs on recorded video files. Therefore, we modified the DLC … including training the DLC on a GPU …","","https://scholar.google.com/scholar?q=related:mo5qfVAe4qMJ:scholar.google.com/&scioq=deeplabcut+dlc&hl=en&as_sdt=2007"
0,"V Collins, KN Bornhoft, A Wolff, S Sinha…","Hierarchical cue control of cocaine seeking in the face of cost",2023,"…","Springer","https://link.springer.com/article/10.1007/s00213-022-06218-1","",183,"2024-02-14 17:48:04","","10.1007/s00213-022-06218-1","","",,,,,0,0.00,0,5,1,"… DeepLabCut model A previous DLC network trained for 500,000 iterations on 1700 … scoring by experimenters and detailed analysis with DeepLabCut. b Intermittent access to cocaine …","https://www.ncbi.nlm.nih.gov/pmc/articles/PMC10131580/","https://scholar.google.com/scholar?q=related:Bf5Z1GwzVTwJ:scholar.google.com/&scioq=deeplabcut+dlc&hl=en&as_sdt=2007"
0,"DT Kutzke, A Wariar, J Sattar","Autonomous robotic re-alignment for face-to-face underwater human-robot interaction",2024,"arXiv preprint arXiv:2401.04320","arxiv.org","https://arxiv.org/abs/2401.04320","",184,"2024-02-14 17:48:04","","","","",,,,,0,0.00,0,3,1,"… With the aggregated dataset, we train a deep neural network based on the DeepLabCut (DLC) framework [43, 44] for torso keypoint estimation. Specifically, we train a ResNet-50based …","https://arxiv.org/pdf/2401.04320","https://scholar.google.com/scholar?q=related:OETqI9kDs-sJ:scholar.google.com/&scioq=deeplabcut+dlc&hl=en&as_sdt=2007"
1,"L Gaßmann, PC Gordon, U Ziemann","P 58 EEG responses from direct cerebellar activation with Transcranial Magnetic Stimulation",2022,"Clinical Neurophysiology","Elsevier","https://www.sciencedirect.com/science/article/pii/S1388245722001079","https://scholar.google.com/scholar?cites=8432950528692106066&as_sdt=2005&sciodt=2007&hl=en",185,"2024-02-14 17:48:04","","","","",,,,,1,0.50,0,3,2,"… Patients &Methods: Using the open-source software DeepLabCut (DLC), we tuned a recurrent convolutional neural net- work (RCNN) to track anatomic landmarks of the upper body by …","","https://scholar.google.com/scholar?q=related:UrMif9PbB3UJ:scholar.google.com/&scioq=deeplabcut+dlc&hl=en&as_sdt=2007"
0,"G Manduca, V Zeni, S Moccia, G Benelli…","Automated image-based analysis unveils acute effects due to sub-lethal pesticide doses exposure*",2023,"2023 45th Annual …","ieeexplore.ieee.org","https://ieeexplore.ieee.org/abstract/document/10340800/","",186,"2024-02-14 17:48:04","","","","",,,,,0,0.00,0,5,1,"… of the insect’s pose at frame level using DeepLabCut (DLC), an online software for pose … DLC software. Five KPs were annotated: the head, thorax, abdomen, and two wings (Fig. 1). …","https://arinex.com.au/EMBC/pdf/full-paper_251.pdf","https://scholar.google.com/scholar?q=related:RwEG18x_iw0J:scholar.google.com/&scioq=deeplabcut+dlc&hl=en&as_sdt=2007"
0,"E Weiss, Y Liu, Q Wang","Optogenetic Locus Coeruleus Stimulation Improves Pupil Size Tracking of Cortical State",2024,"bioRxiv","biorxiv.org","https://www.biorxiv.org/content/10.1101/2024.02.02.578675.abstract","",187,"2024-02-14 17:48:04","","10.1101/2024.02.02.578675.abstract","","",,,,,0,0.00,0,3,1,"… The DeepLabCut (DLC) toolbox was used to segment the pupil contour in a pre-defined region of interests (ROI). The resnet50 deep network was trained on each labeled frame and …","https://www.biorxiv.org/content/biorxiv/early/2024/02/04/2024.02.02.578675.full.pdf","https://scholar.google.com/scholar?q=related:rBSgBXv3S_cJ:scholar.google.com/&scioq=deeplabcut+dlc&hl=en&as_sdt=2007"
4,"VFL Fernandes, Y Glaser, M Iwashita, M Yoshizawa","Possible role of left–right asymmetry in the sensory system and behavior during adaptation to food-sparse cave environments",2022,"bioRxiv","biorxiv.org","https://www.biorxiv.org/content/10.1101/2022.07.09.499441.abstract","https://scholar.google.com/scholar?cites=2584763341631153624&as_sdt=2005&sciodt=2007&hl=en",188,"2024-02-14 17:48:04","","10.1101/2022.07.09.499441.abstract","","",,,,,4,2.00,1,4,2,"… actual analysis related to DeepLabCut- 38 based aanalysis, … ,co-developed DeepLabCut-based analysis method and 41 … With the aid of a DLC neural network (trained with 807 images…","https://www.biorxiv.org/content/biorxiv/early/2022/07/11/2022.07.09.499441.full.pdf","https://scholar.google.com/scholar?q=related:2GVghpDs3iMJ:scholar.google.com/&scioq=deeplabcut+dlc&hl=en&as_sdt=2007"
0,"LM Martini, A Bognár, R Vogels, MA Giese","MacAction: Realistic 3D macaque body animation based on multi-camera markerless motion capture",2024,"bioRxiv","biorxiv.org","https://www.biorxiv.org/content/10.1101/2024.01.29.577734.abstract","",189,"2024-02-14 17:48:04","","10.1101/2024.01.29.577734.abstract","","",,,,,0,0.00,0,4,1,"… We were able to reduce the remaining errors in DLC by … For the test frames, DLC and Anipose showed smaller prediction … As with DeepLabCut, we created custom scripts to align the …","https://www.biorxiv.org/content/10.1101/2024.01.29.577734.full.pdf","https://scholar.google.com/scholar?q=related:LxQIP7Di1OIJ:scholar.google.com/&scioq=deeplabcut+dlc&hl=en&as_sdt=2007"
0,"MD Vincenzo","Exploring a Siamese Neural Network as a novel individual cow identification technique for daily monitoring free water intake",2024,"","studenttheses.uu.nl","https://studenttheses.uu.nl/bitstream/handle/20.500.12932/45892/Report%20Di%20Vincenzo.pdf?sequence=1","",190,"2024-02-14 17:48:04","PDF","","","",,,,,0,0.00,0,1,1,"… Once achieved, our model can work with pose estimation systems like DeepLabCut to … For example, DLC empowers users to precisely determine the spatial positions of various …","https://studenttheses.uu.nl/bitstream/handle/20.500.12932/45892/Report%20Di%20Vincenzo.pdf?sequence=1","https://scholar.google.com/scholar?q=related:mnxPQte_7fIJ:scholar.google.com/&scioq=deeplabcut+dlc&hl=en&as_sdt=2007"
3,"SW Centanni, ACW Smith","PiRATeMC: A highly flexible, scalable, and low-cost system for obtaining high quality video recordings for behavioral neuroscience",2023,"Addiction Neuroscience","Elsevier","https://www.sciencedirect.com/science/article/pii/S2772392523000512","https://scholar.google.com/scholar?cites=15155803490067069264&as_sdt=2005&sciodt=2007&hl=en",191,"2024-02-14 17:48:04","HTML","","","",,,,,3,3.00,2,2,1,"… Using unbiased pose estimation techniques with open-source machine learning-based software such as DeepLabCut (DLC) [2,3], and behavioral mapping or clustering analysis with …","https://www.sciencedirect.com/science/article/pii/S2772392523000512","https://scholar.google.com/scholar?q=related:ULkSr_k6VNIJ:scholar.google.com/&scioq=deeplabcut+dlc&hl=en&as_sdt=2007"
1,"M Van De Poll…","Whole-brain electrophysiology in Drosophila during sleep and wake",2023,"Cold Spring Harbor …","cshprotocols.cshlp.org","https://cshprotocols.cshlp.org/content/early/2023/12/26/pdb.prot108418.abstract","https://scholar.google.com/scholar?cites=17922077986202614028&as_sdt=2005&sciodt=2007&hl=en",192,"2024-02-14 17:48:04","","","","",,,,,1,1.00,1,2,1,"… DeepLabCut and running the suite are available from the GitHub repository). The output of DLC… In brief, for this use case, DeepLabCut is fed video recordings of a tethered individual and…","","https://scholar.google.com/scholar?q=related:DHl0JPkCuPgJ:scholar.google.com/&scioq=deeplabcut+dlc&hl=en&as_sdt=2007"
2,"SV Gore, R Kakodkar, T Del Rosario Hernández…","Zebrafish Larvae Position Tracker (Z-LaP Tracker): a high-throughput deep-learning behavioral approach for the identification of calcineurin pathway …",2023,"Scientific Reports","nature.com","https://www.nature.com/articles/s41598-023-30303-w","https://scholar.google.com/scholar?cites=17903682497920041906&as_sdt=2005&sciodt=2007&hl=en",193,"2024-02-14 17:48:04","HTML","","","",,,,,2,2.00,1,4,1,"… To train a deep learning model using DeepLabCut we first … , and (2) a trained DeepLabCut model is reliably able to detect … Z-LaP Tracker, a modification of DeepLabCut (DLC), to detect …","https://www.nature.com/articles/s41598-023-30303-w","https://scholar.google.com/scholar?q=related:sgPnw1-odvgJ:scholar.google.com/&scioq=deeplabcut+dlc&hl=en&as_sdt=2007"
2,"L Wade, L Needham, M Evans…","Application of deep learning-based pose estimation methods for clinical gait outcome measures",2022,"Congress of the …","researchportal.bath.ac.uk","https://researchportal.bath.ac.uk/files/228031207/BioCV_Poster_Landscape.pdf","https://scholar.google.com/scholar?cites=12566038411010998143&as_sdt=2005&sciodt=2007&hl=en",194,"2024-02-14 17:48:04","","","","",,,,,2,1.00,1,4,2,"… • Image data from each machine-vision camera were processed using OpenPose[1] (OP), AlphaPose[2] (AP) and the DeepLabCut[3] (DLC) pretrained human pose model. Joint centre …","","https://scholar.google.com/scholar?q=related:f385aluJY64J:scholar.google.com/&scioq=deeplabcut+dlc&hl=en&as_sdt=2007"
0,"PA Kakalec","The Use of Support Vector Machines and Hierarchical Linear Modeling in Morris Water Maze Analysis",2023,"","","","",195,"2024-02-14 17:48:04","CITATION","","","",,,,,0,0.00,0,1,1,"","","https://scholar.google.com/scholar?q=related:oczC4WsBL2sJ:scholar.google.com/&scioq=deeplabcut+dlc&hl=en&as_sdt=2007"
11,"AA Blackwell, A Fesshaye, A Tidmore, RI Lake…","Rapid loss of fine motor skills after low dose space radiation exposure",2022,"Behavioural Brain …","Elsevier","https://www.sciencedirect.com/science/article/pii/S0166432822001759","https://scholar.google.com/scholar?cites=5388739359117627264&as_sdt=2005&sciodt=2007&hl=en",196,"2024-02-14 17:48:04","","","","",,,,,11,5.50,2,5,2,"… 3 for labeled DLC screenshot). A network was trained in DLC using one video from each rat; … After all videos were labeled with DLC, the XY output was screened for errors, including …","https://www.sciencedirect.com/science/article/am/pii/S0166432822001759","https://scholar.google.com/scholar?q=related:gE9fd-WlyEoJ:scholar.google.com/&scioq=deeplabcut+dlc&hl=en&as_sdt=2007"
6,"W Ren, P Wei, S Yu, YQ Zhang","Left-right asymmetry and attractor-like dynamics of dog's tail wagging during dog-human interactions",2022,"Iscience","cell.com","https://www.cell.com/iscience/pdf/S2589-0042(22)01019-7.pdf","https://scholar.google.com/scholar?cites=13144511881077496962&as_sdt=2005&sciodt=2007&hl=en",197,"2024-02-14 17:48:04","PDF","","","",,,,,6,3.00,2,4,2,"… Using tools provided by DLC, we 310 labeled 3000 frames evenly selected from all 30 sessions (three sessions/animal), with 300 frames 311 from each animal. The accuracy of DLC …","https://www.cell.com/iscience/pdf/S2589-0042(22)01019-7.pdf","https://scholar.google.com/scholar?q=related:gpyGyemvarYJ:scholar.google.com/&scioq=deeplabcut+dlc&hl=en&as_sdt=2007"
1,"AK Dickerson, FT Muijres…","Using videography to study the biomechanics and behavior of freely moving mosquitoes",2023,"Cold Spring Harbor …","cshprotocols.cshlp.org","https://cshprotocols.cshlp.org/content/2023/2/pdb.top107676.short","https://scholar.google.com/scholar?cites=8154884973474983563&as_sdt=2005&sciodt=2007&hl=en",198,"2024-02-14 17:48:04","","","","",,,,,1,1.00,0,3,1,"… For example, Tracker, the simplest package, can produce the same types of tracks as DLC, but perhaps at a higher manual labor cost. Thus, the choice which software is best for your …","","https://scholar.google.com/scholar?q=related:i64lTK34K3EJ:scholar.google.com/&scioq=deeplabcut+dlc&hl=en&as_sdt=2007"
0,"K Akiti","Dopamine in the tail of striatum regulates post-assessment avoidance of stimulus novelty",2021,"","search.proquest.com","https://search.proquest.com/openview/cc7fbdec459875093458a69080259c33/1?pq-origsite=gscholar&cbl=18750&diss=y","",199,"2024-02-14 17:48:04","","","","",,,,,0,0.00,0,1,3,"… in getting me set up with DeepLabCut and Moseq. These tools … worC alongside you as we got DeepLabCut and Moseq up and … After running DLC on each video file, we processed the …","https://dash.harvard.edu/bitstream/handle/1/37370177/akiti_dissertation_210909_final.pdf?sequence=1&isAllowed=n","https://scholar.google.com/scholar?q=related:v67QHyx540QJ:scholar.google.com/&scioq=deeplabcut+dlc&hl=en&as_sdt=2007"
1,"M Söderström","Pose Classification of Horse Behavior in Video: A deep learning approach for classifying equine poses based on 2D keypoints",2021,"","diva-portal.org","https://www.diva-portal.org/smash/record.jsf?pid=diva2:1609020","https://scholar.google.com/scholar?cites=939249425101386694&as_sdt=2005&sciodt=2007&hl=en",200,"2024-02-14 17:48:04","","","","",,,,,1,0.33,1,1,3,"… From the DLC toolbox [33] we obtain reconstructed 2D keypoints of the labeled body parts. … In this project we use the DeepLabCut toolbox [33], but other toolboxes for pose estimation …","https://www.diva-portal.org/smash/get/diva2:1609020/FULLTEXT01.pdf","https://scholar.google.com/scholar?q=related:xnOoMmDiCA0J:scholar.google.com/&scioq=deeplabcut+dlc&hl=en&as_sdt=2007"
8,"S Szabo, M Alexy","Practical aspects of weight measurement using image processing methods in waterfowl production",2022,"Agriculture","mdpi.com","https://www.mdpi.com/2077-0472/12/11/1869","https://scholar.google.com/scholar?cites=8813313666523547105&as_sdt=2005&sciodt=2007&hl=en",201,"2024-02-14 17:48:04","","","","",,,,,8,4.00,4,2,2,"… DeepLabCut is an open-source software that specifically helps to estimate animal poses … a separate library (DLC live) that allows for the processing of live recordings. DLC was used to …","https://www.mdpi.com/2077-0472/12/11/1869/pdf","https://scholar.google.com/scholar?q=related:4UU7sxUuT3oJ:scholar.google.com/&scioq=deeplabcut+dlc&hl=en&as_sdt=2007"
3,"HM Woo, WS Kim, S Hong…","Machine learning enabled adaptive wireless power transmission system for neuroscience study",2020,"2020 54th Asilomar …","ieeexplore.ieee.org","https://ieeexplore.ieee.org/abstract/document/9443501/","https://scholar.google.com/scholar?cites=9587079117227953915&as_sdt=2005&sciodt=2007&hl=en",202,"2024-02-14 17:48:04","","","","",,,,,3,0.75,1,4,4,"… Another example is DeepLabCut (DLC), a novel algorithm that has been specifically … By eliminating the need for explicit markers, DLC can effectively detect userdefined body parts of …","","https://scholar.google.com/scholar?q=related:-w7wn6klDIUJ:scholar.google.com/&scioq=deeplabcut+dlc&hl=en&as_sdt=2007"
8,"H Liu, AR Reibman, JP Boerman","A cow structural model for video analytics of cow health",2020,"arXiv preprint arXiv:2003.05903","arxiv.org","https://arxiv.org/abs/2003.05903","https://scholar.google.com/scholar?cites=11449700771534255525&as_sdt=2005&sciodt=2007&hl=en",203,"2024-02-14 17:48:04","","","","",,,,,8,2.00,3,3,4,"… In our system, we apply the original DeepLabCut network [4], labeled CNN1, to extract … method, which is the original method in the DeepLabCut (DLC) toolbox [4]. However, this method …","https://arxiv.org/pdf/2003.05903","https://scholar.google.com/scholar?q=related:pbXQRzCC5Z4J:scholar.google.com/&scioq=deeplabcut+dlc&hl=en&as_sdt=2007"
6,"AS Chockley, GF Dinges, G Di Cristina…","Subsets of leg proprioceptors influence leg kinematics but not interleg coordination in Drosophila melanogaster walking",2022,"Journal of …","journals.biologists.com","https://journals.biologists.com/jeb/article-abstract/225/20/jeb244245/278431","https://scholar.google.com/scholar?cites=18132074055067780913&as_sdt=2005&sciodt=2007&hl=en",204,"2024-02-14 17:48:04","","","","",,,,,6,3.00,2,4,2,"… using DeepLabCut (DLC). Note, that because of the ventral aspect, left and right body sides are flipped. A color map of these six legs is used consistently throughout the text and figures. …","https://journals.biologists.com/jeb/article/225/20/jeb244245/278431?utm_source=TrendMD&utm_medium=cpc&utm_campaign=J_Exp_Biol_TrendMD_0","https://scholar.google.com/scholar?q=related:MUdkBUkRovsJ:scholar.google.com/&scioq=deeplabcut+dlc&hl=en&as_sdt=2007"
0,"CH Tartanoglu","Markerless 3D tracking and reconstruction of subjects with multiple stereo cameras",2019,"","duo.uio.no","https://www.duo.uio.no/bitstream/handle/10852/80806/1/Master_Thesis__DeepLabCut.pdf","",205,"2024-02-14 17:48:04","PDF","","","",,,,,0,0.00,0,1,5,"… fore, laid the foundation for application such as DeepLabCut (DLC), which enables states of the art markerless pose estimation. DLC also supports 3D localization by stereo vision and …","https://www.duo.uio.no/bitstream/handle/10852/80806/1/Master_Thesis__DeepLabCut.pdf","https://scholar.google.com/scholar?q=related:EgLtJl1k_F0J:scholar.google.com/&scioq=deeplabcut+dlc&hl=en&as_sdt=2007"
0,"OR Stanley, A Swaminathan, E Wojahn, ZM Ahmed…","An Open-Source Tool for Automated Human-Level Circling Behavior Detection",2023,"bioRxiv","biorxiv.org","https://www.biorxiv.org/content/10.1101/2023.05.30.540066.abstract","",206,"2024-02-14 17:48:04","","10.1101/2023.05.30.540066.abstract","","",,,,,0,0.00,0,5,1,"… In the present study, we chose to use the open-source markerless feature-tracking toolbox DeepLabCut (""DLC"") to track the positions of keypoints on animals. Notably however, as …","https://www.biorxiv.org/content/10.1101/2023.05.30.540066.full.pdf","https://scholar.google.com/scholar?q=related:W6uInZW35kAJ:scholar.google.com/&scioq=deeplabcut+dlc&hl=en&as_sdt=2007"
1,"P Le Floch, S Zhao, R Liu, N Molinari, E Medina…","3D spatiotemporally scalable in vivo neural probes based on fluorinated elastomers",2023,"Nature …","nature.com","https://www.nature.com/articles/s41565-023-01545-6","https://scholar.google.com/scholar?cites=14302586999972739341&as_sdt=2005&sciodt=2007&hl=en",207,"2024-02-14 17:48:04","","","","",,,,,1,1.00,0,6,1,"… We used DLC to label the hind paws and detect the footfall using a peak detection algorithm, with video verification by the researchers. We also used DLC to perform limb tracking of six …","","https://scholar.google.com/scholar?q=related:Dbl-Hhn_fMYJ:scholar.google.com/&scioq=deeplabcut+dlc&hl=en&as_sdt=2007"
0,"MA Hafeez","Low-Cost Objective Measurement of Prehension Skills",2023,"","etheses.whiterose.ac.uk","https://etheses.whiterose.ac.uk/33307/","",208,"2024-02-14 17:48:04","","","","",,,,,0,0.00,0,1,1,"… The research also explored marker-less pose estimation using deep learning tools, specifically DeepLabCut (DLC), for reach-to-grasp tracking. Despite challenges posed by COVID-19 …","https://etheses.whiterose.ac.uk/33307/1/Hafeez_MA_Mechanical_PhD_2023.pdf","https://scholar.google.com/scholar?q=related:EMEKbjkJ48AJ:scholar.google.com/&scioq=deeplabcut+dlc&hl=en&as_sdt=2007"
0,"C Yin, MD Melin, G Rojas-Bowe, XR Sun, S Gluf…","Engaged decision-makers align spontaneous movements to stereotyped task demands",2023,"bioRxiv","ncbi.nlm.nih.gov","https://www.ncbi.nlm.nih.gov/pmc/articles/PMC10327038/","",209,"2024-02-14 17:48:04","HTML","","","",,,,,0,0.00,0,6,1,"… DeepLabCut (DLC) was used to label 28 body parts in mice. … based on the movements of the DLC labels. D. Animals make … -trial variance of the DLC label positions using the variables …","https://www.ncbi.nlm.nih.gov/pmc/articles/PMC10327038/","https://scholar.google.com/scholar?q=related:ofsBcQZGz0YJ:scholar.google.com/&scioq=deeplabcut+dlc&hl=en&as_sdt=2007"
0,"G Chelini, EM Trombetta, T Fortunato-Asquini, O Ollari…","Automated Segmentation of the Mouse Body Language to Study Stimulus-Evoked Emotional Behaviors",2023,"Eneuro","eneuro.org","https://www.eneuro.org/content/10/9/ENEURO.0514-22.2023.abstract","",210,"2024-02-14 17:48:04","","","","",,,,,0,0.00,0,5,1,"… For instance, using the pose-estimation software DeepLabCut (DLC), it is possible to … require dedicated analysis pipeline to swiftly transform DLC output files into interpretable results. …","https://www.eneuro.org/content/10/9/ENEURO.0514-22.2023.full","https://scholar.google.com/scholar?q=related:OO8F6Svn9ZMJ:scholar.google.com/&scioq=deeplabcut+dlc&hl=en&as_sdt=2007"
