Cites,Authors,Title,Year,Source,Publisher,ArticleURL,CitesURL,GSRank,QueryDate,Type,DOI,ISSN,CitationURL,Volume,Issue,StartPage,EndPage,ECC,CitesPerYear,CitesPerAuthor,AuthorCount,Age,Abstract,FullTextURL,RelatedURL
0,"JE Villacres, N Riveira, S Kim, LL Colgin…","Abnormal patterns of sleep and waking behaviors are accompanied by neocortical oscillation disturbances in an Ank3 mouse model of epilepsy-bipolar …",2023,"Translational …","nature.com","https://www.nature.com/articles/s41398-023-02700-2","",347,"2024-02-14 17:48:04","HTML","","","",,,,,0,0.00,0,5,1,"… We used DeepLabCut (DLC) [34] to obtain estimates of animals’ positions, and a previously published method to classify awake behaviors and sleep [35], from home cage videos (…","https://www.nature.com/articles/s41398-023-02700-2","https://scholar.google.com/scholar?q=related:aLWloQemCbcJ:scholar.google.com/&scioq=deeplabcut+dlc&hl=en&as_sdt=2007"
0,"X Guo, G Jia, M Al-Khulaqui, Z Chen…","Real-Time Pose Estimation of Rats Based on Stereo Vision Embedded in a Robotic Rat",2023,"2023 IEEE/RSJ …","ieeexplore.ieee.org","https://ieeexplore.ieee.org/abstract/document/10342475/","",348,"2024-02-14 17:48:04","","","","",,,,,0,0.00,0,5,1,"… , which is lower than all backbones in Deeplabcut (a toolbox more frequently used … DLC, we use the same dataset and keep the same allocation ratio. There are many backbones in DLC…","","https://scholar.google.com/scholar?q=related:wJ5fxoaYj4sJ:scholar.google.com/&scioq=deeplabcut+dlc&hl=en&as_sdt=2007"
0,"A Barik, P Reddy","A DEEP-LEARNING DRIVEN INVESTIGATION OF CIRCUIT BASIS FOR REFLEXIVE HYPERSENSITIVITY TO PAIN",2023,"IBRO Neuroscience Reports","ibroneuroreports.org","https://www.ibroneuroreports.org/article/S2667-2421(23)01403-3/abstract","",349,"2024-02-14 17:48:04","","","","",,,,,0,0.00,0,2,1,"… Here, we apply DeeplabCut (DLC) to dissect mouse behavior on the thermal-plate test — a commonly used paradigm to ascertain supraspinal contributions to noxious thermal …","","https://scholar.google.com/scholar?q=related:Ow-KV4phZT4J:scholar.google.com/&scioq=deeplabcut+dlc&hl=en&as_sdt=2007"
7,"M Berger, A Gail","The Reach Cage environment for wireless neural recordings during structured goal-directed behavior of unrestrained monkeys",2018,"bioRxiv","biorxiv.org","https://www.biorxiv.org/content/10.1101/305334.abstract","https://scholar.google.com/scholar?cites=7861792708518091662&as_sdt=2005&sciodt=2007&hl=en",350,"2024-02-14 17:48:04","","10.1101/305334.abstract","","",,,,,7,1.17,4,2,6,"Abstract System neuroscience of motor cognition regarding the space beyond immediate reach mandates free, yet experimentally controlled movements. We present an experimental …","https://www.biorxiv.org/content/biorxiv/early/2020/03/05/305334.full.pdf","https://scholar.google.com/scholar?q=related:jhv6mNCyGm0J:scholar.google.com/&scioq=deeplabcut+dlc&hl=en&as_sdt=2007"
2,"L Schuster, R Henderson, S Sankar, D Ananth, M Kirk…","Longitudinal monitoring of maternal care and maternal neglect",2022,"bioRxiv","biorxiv.org","https://www.biorxiv.org/content/10.1101/2022.12.26.521927.abstract","https://scholar.google.com/scholar?cites=2020899783296018831&as_sdt=2005&sciodt=2007&hl=en",351,"2024-02-14 17:48:04","","10.1101/2022.12.26.521927.abstract","","",,,,,2,1.00,0,6,2,"… For analysis of video data, we used two different DeepLabCut (DLC) 283 networks: one … frame-by-frame pose data obtained with DLC to identify episodes of dam nest entry or 286 exit. …","https://www.biorxiv.org/content/biorxiv/early/2022/12/26/2022.12.26.521927.full.pdf","https://scholar.google.com/scholar?q=related:j-kFTqWtCxwJ:scholar.google.com/&scioq=deeplabcut+dlc&hl=en&as_sdt=2007"
1,"N Cheng, Q Dong, Z Zhang, L Wang, X Chen, C Wang","Egocentric processing of items in spines, dendrites, and somas in the retrosplenial cortex",2023,"Neuron","cell.com","https://www.cell.com/neuron/pdf/S0896-6273(23)00892-9.pdf","https://scholar.google.com/scholar?cites=16317689985703660127&as_sdt=2005&sciodt=2007&hl=en",352,"2024-02-14 17:48:04","","","","",,,,,1,1.00,0,6,1,"… A webcam was used to capture the behavioral data at 25 Hz, which was further analyzed by DeepLabCut (DLC) to extract the position and head direction of the animals.The direction …","","https://scholar.google.com/scholar?q=related:X8rQUJYUdOIJ:scholar.google.com/&scioq=deeplabcut+dlc&hl=en&as_sdt=2007"
2,"K Huang, Y Han, K Chen, H Pan, W Yi, X Li, S Liu…","Mapping Mouse Behavior with an Unsupervised Spatio-temporal Sequence Decomposition Framework",2020,"bioRxiv","scholar.archive.org","https://scholar.archive.org/work/4ujrja7w65dx7g7i6nfnxkdhpy/access/wayback/https://www.biorxiv.org/content/biorxiv/early/2020/09/16/2020.09.14.295808.full.pdf","https://scholar.google.com/scholar?cites=1464288216591553016&as_sdt=2005&sciodt=2007&hl=en",353,"2024-02-14 17:48:04","PDF","","","",,,,,2,0.50,0,8,4,"… To evaluate the quality of the 3D skeletal data, we checked the DeepLabCut 11 (DLC) tracking likelihood in the 12×4 videos (0.9807±0.1224, Fig. 5). After artifact detection and 12 …","https://scholar.archive.org/work/4ujrja7w65dx7g7i6nfnxkdhpy/access/wayback/https://www.biorxiv.org/content/biorxiv/early/2020/09/16/2020.09.14.295808.full.pdf","https://scholar.google.com/scholar?q=related:-NG69l8yUhQJ:scholar.google.com/&scioq=deeplabcut+dlc&hl=en&as_sdt=2007"
1,"M Labouesse, A Torres-Herraez, M Chohan, J Villarin…","A non-canonical striatopallidal “Go” pathway that supports motor control",2023,"","researchsquare.com","https://www.researchsquare.com/article/rs-2524816/latest","https://scholar.google.com/scholar?cites=17127423011401809615&as_sdt=2005&sciodt=2007&hl=en",354,"2024-02-14 17:48:04","","","","",,,,,1,1.00,0,5,1,"… Mice are video-recorded in the open field and body positions obtained with DeepLabCut D. 5 Left: Representative body trajectory. Middle: Representative trace of mouse speed over …","https://www.researchsquare.com/article/rs-2524816/latest.pdf","https://scholar.google.com/scholar?q=related:z7504HvUsO0J:scholar.google.com/&scioq=deeplabcut+dlc&hl=en&as_sdt=2007"
1,"AA Blackwell, JA Tracz, AS Fesshaye…","Fine motor deficits exhibited in rat string-pulling behavior following exposure to sleep fragmentation and deep space radiation",2023,"Experimental Brain …","Springer","https://link.springer.com/article/10.1007/s00221-022-06527-z","https://scholar.google.com/scholar?cites=2335760404901183747&as_sdt=2005&sciodt=2007&hl=en",355,"2024-02-14 17:48:04","","10.1007/s00221-022-06527-z","","",,,,,1,1.00,0,4,1,"… machine learning program DeepLabCut (DLC) (v2.1 Mathis et al. 2018). DLC was used to … Twenty random video frames from one video per rat were extracted via k-means using DLC. …","","https://scholar.google.com/scholar?q=related:A8GOfrZJaiAJ:scholar.google.com/&scioq=deeplabcut+dlc&hl=en&as_sdt=2007"
0,"K Huang, Y Han, K Chen, H Pan, W Yi, X Li, S Liu…","Mapping and Understanding Mouse Behaviors via an Unsupervised Method",2020,"bioRxiv","biorxiv.org","https://www.biorxiv.org/content/biorxiv/early/2021/03/17/2020.09.14.295808.full.pdf","",356,"2024-02-14 17:48:04","PDF","","","",,,,,0,0.00,0,8,4,"… To evaluate the quality of the 3D skeletal data, we checked the DeepLabCut (DLC) tracking likelihood in the 12×4 videos (0.9807±0.1224, Figure S5). After artifact detection and …","https://www.biorxiv.org/content/biorxiv/early/2021/03/17/2020.09.14.295808.full.pdf","https://scholar.google.com/scholar?q=related:830woCNc02UJ:scholar.google.com/&scioq=deeplabcut+dlc&hl=en&as_sdt=2007"
0,"A Burton, Z Wang, D Song, S Tran, J Hanna…","Fully implanted battery-free high power platform for chronic spinal and muscular functional electrical stimulation",2023,"Nature …","nature.com","https://www.nature.com/articles/s41467-023-43669-2","",357,"2024-02-14 17:48:04","HTML","","","",,,,,0,0.00,0,6,1,"… Movements evoked by spinal and muscle stimulation are monitored by kinematic tracking of the limb with DeepLabCut (DLC), with the magnitude of the evoked movement quantified as …","https://www.nature.com/articles/s41467-023-43669-2","https://scholar.google.com/scholar?q=related:Tm2T5BV-SY4J:scholar.google.com/&scioq=deeplabcut+dlc&hl=en&as_sdt=2007"
9,"P Ravbar, N Zhang, JH Simpson","Behavioral evidence for nested central pattern generator control of Drosophila grooming",2021,"Elife","elifesciences.org","https://elifesciences.org/articles/71508","https://scholar.google.com/scholar?cites=18111461779756545221&as_sdt=2005&sciodt=2007&hl=en",358,"2024-02-14 17:48:04","","","","",,,,,9,3.00,3,3,3,"… We confirm the frequency and periodicity of leg movements during grooming using Deep Lab Cut (DLC) to analyze an independent video data set. DLC is a method developed for …","https://elifesciences.org/articles/71508.pdf","https://scholar.google.com/scholar?q=related:xfRzsYfWWPsJ:scholar.google.com/&scioq=deeplabcut+dlc&hl=en&as_sdt=2007"
0,"I Step, II Step","xinyangubc/b-soid Goto Github PK",,"githubhelp.com","","https://githubhelp.com/xinyangubc/B-SOID","",359,"2024-02-14 17:48:04","","","","",,,,,0,0.00,0,2,,"… DeepLabCut 1,2,3 has revolutionized the way behavioral … Behavioral segmentation of open field in DeepLabCut, or B-SOID (… Upon DeepLabCut estimating the positions of 6 body parts (…","","https://scholar.google.com/scholar?q=related:53r9Ml9Q7LIJ:scholar.google.com/&scioq=deeplabcut+dlc&hl=en&as_sdt=2007"
0,"C Zimmermann","Estimating shape and pose from images",2020,"","Dissertation, Universität Freiburg …","","",360,"2024-02-14 17:48:04","CITATION","","","",,,,,0,0.00,0,1,4,"","","https://scholar.google.com/scholar?q=related:7sc57iJm-H8J:scholar.google.com/&scioq=deeplabcut+dlc&hl=en&as_sdt=2007"
0,"JPO Platt","Subthalamic Nucleus Contribution to Goal-Directed Movements in Parkinson's Disease",2023,"","search.proquest.com","https://search.proquest.com/openview/836ccca1dbd85a3caa72e654c91d05a8/1?pq-origsite=gscholar&cbl=18750&diss=y","",361,"2024-02-14 17:48:04","","","","",,,,,0,0.00,0,1,1,"… DLC, the video captured using the center camera was processed to generate distance traveled in a 2D plane using a custom Python script. Using the provided GUI for DLC … DeepLabCut…","","https://scholar.google.com/scholar?q=related:VVXmcC5zTMkJ:scholar.google.com/&scioq=deeplabcut+dlc&hl=en&as_sdt=2007"
0,"E Bermudez, MH Mohajerani, IQ Whishaw","Challenges of a small world analysis for the continuous monitoring of behavior in mice",,"osf.io","","https://osf.io/zfqr8/download","",362,"2024-02-14 17:48:04","PDF","","","",,,,,0,0.00,0,3,,"… 22 We used 200 frames from 6 different 20 min videos to train DLC for 1,000,000 iterations. … DeepLabCut: markerless pose estimation of user-defined body parts with deep 22 learning. …","https://osf.io/zfqr8/download","https://scholar.google.com/scholar?q=related:EszkK_8K7i0J:scholar.google.com/&scioq=deeplabcut+dlc&hl=en&as_sdt=2007"
1,"D Garbarino, M Moro, C Tacchino, P Moretti…","Attributed Graphettes-Based Preterm Infants Motion Analysis",2022,"Complex Networks & …","Springer","https://link.springer.com/chapter/10.1007/978-3-030-93409-5_8","https://scholar.google.com/scholar?cites=15569887022633802887&as_sdt=2005&sciodt=2007&hl=en",363,"2024-02-14 17:48:04","","10.1007/978-3-030-93409-5_8","","",,,,,1,0.50,0,5,2,"… To this aim, we rely on a deep model for semantic features detection, DeepLabCut (DLC) [20], … Among the different deep architectures provided in DLC, we select a ResNet-50 [17] …","","https://scholar.google.com/scholar?q=related:h1wNGcFZE9gJ:scholar.google.com/&scioq=deeplabcut+dlc&hl=en&as_sdt=2007"
0,"KR Nygaard, SE Maloney, RG Swift…","Extensive characterization of a Williams syndrome murine model shows Gtf2ird1‐mediated rescue of select sensorimotor tasks, but no effect on enhanced social …",2023,"Genes, Brain and …","Wiley Online Library","https://onlinelibrary.wiley.com/doi/abs/10.1111/gbb.12853","",364,"2024-02-14 17:48:04","","10.1111/gbb.12853","","",,,,,0,0.00,0,4,1,"… For analysis, we used the DeepLabCut (DLC) neural network for pose estimation, version 2.2rc3 using the resnetv50, 22 followed by the Simple Behavior Annotator (simBA) version …","https://onlinelibrary.wiley.com/doi/pdf/10.1111/gbb.12853","https://scholar.google.com/scholar?q=related:7op3J9j9eSEJ:scholar.google.com/&scioq=deeplabcut+dlc&hl=en&as_sdt=2007"
19,"ES Schaffer, N Mishra, MR Whiteway, W Li…","Flygenvectors: the spatial and temporal structure of neural activity across the fly brain",2021,"bioRxiv","biorxiv.org","https://www.biorxiv.org/content/10.1101/2021.09.25.461804.abstract","https://scholar.google.com/scholar?cites=8803613143337129010&as_sdt=2005&sciodt=2007&hl=en",365,"2024-02-14 17:48:04","","10.1101/2021.09.25.461804.abstract","","",,,,,19,6.33,4,5,3,"… DeepLabCut (DLC) (46) GUI, for a total of 850 labeled frames. We then trained DGP on these frames, which augments the supervised loss of DLC … -hoc smoothing of the DLC markers. …","https://www.biorxiv.org/content/biorxiv/early/2021/09/26/2021.09.25.461804.full.pdf","https://scholar.google.com/scholar?q=related:MtSRpIK3LHoJ:scholar.google.com/&scioq=deeplabcut+dlc&hl=en&as_sdt=2007"
66,"F Birey, MY Li, A Gordon, MV Thete, AM Valencia…","Dissecting the molecular basis of human interneuron migration in forebrain assembloids from Timothy syndrome",2022,"Cell Stem Cell","cell.com","https://www.cell.com/cell-stem-cell/pdf/S1934-5909(21)00483-5.pdf","https://scholar.google.com/scholar?cites=8296822977076973782&as_sdt=2005&sciodt=2007&hl=en",366,"2024-02-14 17:48:04","PDF","","","",,,,,66,33.00,11,6,2,"… (F) Schematic illustrating the DeepLabCut analysis pipeline. (… front positions were tracked using DeepLabCut. (H) Distance … The migration imaging for DeepLabCut (DLC) analysis was …","https://www.cell.com/cell-stem-cell/pdf/S1934-5909(21)00483-5.pdf","https://scholar.google.com/scholar?q=related:1tD4CIo8JHMJ:scholar.google.com/&scioq=deeplabcut+dlc&hl=en&as_sdt=2007"
1,"H Goñi-Erro, R Selvan, V Caggiano, R Leiras…","Pedunculopontine Chx10+ neurons control global motor arrest in mice",2023,"Nature …","nature.com","https://www.nature.com/articles/s41593-023-01396-3","https://scholar.google.com/scholar?cites=769725121868762054&as_sdt=2005&sciodt=2007&hl=en",367,"2024-02-14 17:48:04","HTML","","","",,,,,1,1.00,0,5,1,"… track the four paws using DeepLabCut (DLC) 73 , … DLC models for fewer number of training iterations, to be more useful than training a single model for a longer duration. The final DLC …","https://www.nature.com/articles/s41593-023-01396-3","https://scholar.google.com/scholar?q=related:xouuj-ucrgoJ:scholar.google.com/&scioq=deeplabcut+dlc&hl=en&as_sdt=2007"
0,"RM Glanz, JC Dooley, G Sokoloff, MS Blumberg","A developmental transition in the sensory coding of limb 5 kinematics in primary motor cortex 6",2020,"","scholar.archive.org","https://scholar.archive.org/work/opyde72sincm7f7wtgypecdtqe/access/wayback/https://www.biorxiv.org/content/biorxiv/early/2021/04/10/2020.12.14.422707.full.pdf","",368,"2024-02-14 17:48:04","PDF","","","",,,,,0,0.00,0,4,4,"… The trajectory of forelimb movements was quantified using DeepLabCut (DLC), a machine-vision 108 tool for behavioral analysis [15,16]. Movement amplitude of the forelimb was …","https://scholar.archive.org/work/opyde72sincm7f7wtgypecdtqe/access/wayback/https://www.biorxiv.org/content/biorxiv/early/2021/04/10/2020.12.14.422707.full.pdf","https://scholar.google.com/scholar?q=related:CAlTcRg0gqAJ:scholar.google.com/&scioq=deeplabcut+dlc&hl=en&as_sdt=2007"
99,"MG Kutlu, JE Zachry, PR Melugin, SA Cajigas…","Dopamine release in the nucleus accumbens core signals perceived saliency",2021,"Current Biology","cell.com","https://www.cell.com/current-biology/pdf/S0960-9822(21)01188-X.pdf","https://scholar.google.com/scholar?cites=3641655778775714384&as_sdt=2005&sciodt=2007&hl=en",369,"2024-02-14 17:48:04","PDF","","","",,,,,99,33.00,20,5,3,"… Video analysis and pose estimation via DeepLabCut We … used DeepLabCut (Python 3, DLC, version 2.2b868) for markerless tracking of position. For fear conditioning experiments, DLC …","https://www.cell.com/current-biology/pdf/S0960-9822(21)01188-X.pdf","https://scholar.google.com/scholar?q=related:UMos8KLCiTIJ:scholar.google.com/&scioq=deeplabcut+dlc&hl=en&as_sdt=2007"
0,"CI Perez, J Luis-Islas, A Lopez, X Diaz, O Molina…","Tesofensine, a novel antiobesity drug, silences GABAergic hypothalamic neurons",2023,"bioRxiv","biorxiv.org","https://www.biorxiv.org/content/10.1101/2023.08.02.551706.abstract","",370,"2024-02-14 17:48:04","","10.1101/2023.08.02.551706.abstract","","",,,,,0,0.00,0,6,1,"… To quantify stereotypic 451 behavior, we used DeepLabCut, a markerless pose estimation … Interestingly, 467 DeepLabCut analysis unveiled for the first time that phentermine-treated …","https://www.biorxiv.org/content/biorxiv/early/2023/08/05/2023.08.02.551706.full.pdf","https://scholar.google.com/scholar?q=related:vZsJazcnXfsJ:scholar.google.com/&scioq=deeplabcut+dlc&hl=en&as_sdt=2007"
0,"EK Vonstad","Improving Exergame Technologies for Older Adults Using Machine Learning",2022,"","ntnuopen.ntnu.no","https://ntnuopen.ntnu.no/ntnu-xmlui/handle/11250/2992438","",371,"2024-02-14 17:48:04","","","","",,,,,0,0.00,0,1,2,"… In contrast, the DeepLabCut (DLC) framework allows the user to add contextual information that can specialize the model to the desired application, for example, providing training data …","https://ntnuopen.ntnu.no/ntnu-xmlui/bitstream/handle/11250/2992438/Elise%20Kl%C3%A6bo%20Vonstad_PhD.pdf?sequence=1","https://scholar.google.com/scholar?q=related:UsR3aXipupkJ:scholar.google.com/&scioq=deeplabcut+dlc&hl=en&as_sdt=2007"
0,"T Newbold","Mechanisms underlying the abnormal respiratory-sympathetic phenotype of the Spontaneously Hypertensive Rat",2022,"","figshare.mq.edu.au","https://figshare.mq.edu.au/ndownloader/files/38639057","",372,"2024-02-14 17:48:04","PDF","","","",,,,,0,0.00,0,1,2,"… Tracking laryngeal adduction with Deep Lab Cut Larynx videos were annotated using Deep Lab Cut software (DLC) [41] . The algorithm was trained based on manually annotated …","https://figshare.mq.edu.au/ndownloader/files/38639057","https://scholar.google.com/scholar?q=related:FUswienJFN0J:scholar.google.com/&scioq=deeplabcut+dlc&hl=en&as_sdt=2007"
0,"RC Warburton, PL Jones","Markerless tracking of bumblebee foraging allows for new metrics of bee behavior and demonstrations of increased foraging efficiency with experience",2024,"Apidologie","Springer","https://link.springer.com/article/10.1007/s13592-023-01036-6","",373,"2024-02-14 17:48:04","","10.1007/s13592-023-01036-6","","",,,,,0,0.00,0,2,1,"… We propose that DeepLabCut also has enormous utility for studying flower selection and visit durations by bumblebees in the types of experimental setups common in bumblebee …","","https://scholar.google.com/scholar?q=related:w7Olfoj04FgJ:scholar.google.com/&scioq=deeplabcut+dlc&hl=en&as_sdt=2007"
0,"NJ Smith-Vickery","Frozen in Fear: Machine Learning Unveils Sex Differences in Rats' Freezing Postures and Defensive Reactions",2023,"","search.proquest.com","https://search.proquest.com/openview/3ef95a3d9d09da1396497c1adafe17e3/1?pq-origsite=gscholar&cbl=18750&diss=y","",374,"2024-02-14 17:48:04","","","","",,,,,0,0.00,0,1,1,"Females are twice as likely as males to be diagnosed with anxiety-related disorders, yet they are underrepresented in preclinical research. We investigated fear responses in female …","https://escholarship.org/content/qt4766h13r/qt4766h13r.pdf","https://scholar.google.com/scholar?q=related:jXmKOpDlp3YJ:scholar.google.com/&scioq=deeplabcut+dlc&hl=en&as_sdt=2007"
3,"C Winters, W Gorssen, M Wöhr…","BAMBI: A new method for automated assessment of bidirectional early-life interaction between maternal behavior and pup vocalization in mouse dam-pup …",2023,"Frontiers in Behavioral …","frontiersin.org","https://www.frontiersin.org/articles/10.3389/fnbeh.2023.1139254/full","https://scholar.google.com/scholar?cites=14218933487580760792&as_sdt=2005&sciodt=2007&hl=en",375,"2024-02-14 17:48:04","HTML","10.3389/fnbeh.2023.1139254","","",,,,,3,3.00,1,4,1,"… using k-means clustering in DLC and labeled manually. Additionally, using the original model 10 extra outlier frames per video were extracted using the DLC “jump” algorithm. Labels in …","https://www.frontiersin.org/articles/10.3389/fnbeh.2023.1139254/full","https://scholar.google.com/scholar?q=related:2Eoo_KvMU8UJ:scholar.google.com/&scioq=deeplabcut+dlc&hl=en&as_sdt=2007"
0,"S Halim","Contribution of ventral pallidal cholinergic neurons to behavioral despair and fear learning",2022,"","193.140.201.98","http://193.140.201.98/handle/123456789/15720","",376,"2024-02-14 17:48:04","","","","",,,,,0,0.00,0,1,2,"… , and the duration spent in each quadrant during the training trials was analyzed using DLC. … , velocity, and the time spent along the periphery and in the center was analyzed using DLC. …","http://193.140.201.98/bitstream/handle/123456789/15720/b2776725.037339.001.PDF?sequence=1&isAllowed=y","https://scholar.google.com/scholar?q=related:pLG7XCImLUQJ:scholar.google.com/&scioq=deeplabcut+dlc&hl=en&as_sdt=2007"
0,"IA Favre-Bulle, E Muller, C Lee, LA Scholz, J Arnold…","Brain-wide impacts of sedation on spontaneous activity and auditory processing in larval zebrafish",2024,"bioRxiv","biorxiv.org","https://www.biorxiv.org/content/10.1101/2024.01.29.577877.abstract","",377,"2024-02-14 17:48:04","","10.1101/2024.01.29.577877.abstract","","",,,,,0,0.00,0,6,1,"… fish automatically, we employed DeepLabCut (DLC)(Mathis et al. 2018). 153 DLC is a deep … DeepLabCut: markerless pose estimation of 688 user-defined body parts with deep learning'…","https://www.biorxiv.org/content/10.1101/2024.01.29.577877.full.pdf","https://scholar.google.com/scholar?q=related:TwVDHZHTWZAJ:scholar.google.com/&scioq=deeplabcut+dlc&hl=en&as_sdt=2007"
4,"ES Schaffer, N Mishra, MR Whiteway, W Li…","The spatial and temporal structure of neural activity across the fly brain",2023,"Nature …","nature.com","https://www.nature.com/articles/s41467-023-41261-2","https://scholar.google.com/scholar?cites=15041866233822624358&as_sdt=2005&sciodt=2007&hl=en",378,"2024-02-14 17:48:04","HTML","","","",,,,,4,4.00,1,5,1,"… DeepLabCut (DLC) 69 GUI. We then trained DGP on these frames, which augments the supervised loss of DLC … the pose estimation, even after post hoc smoothing of the DLC markers. …","https://www.nature.com/articles/s41467-023-41261-2","https://scholar.google.com/scholar?q=related:Zrrw-aRxv9AJ:scholar.google.com/&scioq=deeplabcut+dlc&hl=en&as_sdt=2007"
0,"Z Ripic","Validation of an Artificial Intelligence-based Markerless Motion Capture System for Clinical Gait Analysis",2022,"","scholarship.miami.edu","https://scholarship.miami.edu/view/pdfCoverPage?instCode=01UOML_INST&filePid=13413928650002976&download=true","",379,"2024-02-14 17:48:04","PDF","","","",,,,,0,0.00,0,1,2,"Accurate quantification of human motion is essential to understand mechanisms of performance, disease, or musculoskeletal injury. Historically, the field of human movement science …","https://scholarship.miami.edu/view/pdfCoverPage?instCode=01UOML_INST&filePid=13413928650002976&download=true","https://scholar.google.com/scholar?q=related:_kfYrsRlC24J:scholar.google.com/&scioq=deeplabcut+dlc&hl=en&as_sdt=2007"
8,"KM Mah, A Torres-Espín, BW Hallworth, JL Bixby…","Automation of training and testing motor and related tasks in pre-clinical behavioural and rehabilitative neuroscience",2021,"Experimental …","Elsevier","https://www.sciencedirect.com/science/article/pii/S0014488621000522","https://scholar.google.com/scholar?cites=728570816759621806&as_sdt=2005&sciodt=2007&hl=en",380,"2024-02-14 17:48:04","","","","",,,,,8,2.67,2,5,3,"… real-time tracking of labels that DeepLabCut was already able to … DeepLabCut has some limitations that should be considered prior to usage. The high accuracy at which DeepLabCut is …","https://www.ncbi.nlm.nih.gov/pmc/articles/PMC10443427/","https://scholar.google.com/scholar?q=related:rmisNkxnHAoJ:scholar.google.com/&scioq=deeplabcut+dlc&hl=en&as_sdt=2007"
10,"M Bohic, LA Pattison, ZA Jhumka, H Rossi…","Mapping the neuroethological signatures of pain, analgesia, and recovery in mice",2023,"Neuron","cell.com","https://www.cell.com/neuron/pdf/S0896-6273(23)00464-6.pdf","https://scholar.google.com/scholar?cites=13999703844281322792&as_sdt=2005&sciodt=2007&hl=en",381,"2024-02-14 17:48:04","","","","",,,,,10,10.00,2,5,1,"… As inputs, we used two positions within the hind paw and two reference points as identified with the deep neural network DeepLabCut (see STAR Methods). B-SOiD then identified and …","","https://scholar.google.com/scholar?q=related:KA0PB3nwSMIJ:scholar.google.com/&scioq=deeplabcut+dlc&hl=en&as_sdt=2007"
0,"A Burton, Z Wang, D Song, S Tran, J Hanna, J Bakall…","A high power, fully implanted and battery free platform for chronic functional electrical stimulation enabled by passive resonator antenna design.",2022,"","researchsquare.com","https://www.researchsquare.com/article/rs-2286467/latest","",382,"2024-02-14 17:48:04","","","","",,,,,0,0.00,0,7,2,"… Movements evoked by spinal and muscle stimulation are monitored by kinematic tracking of the limb with DeepLabCut (DLC), with the magnitude of the evoked movement quanti ed as …","https://www.researchsquare.com/article/rs-2286467/latest.pdf","https://scholar.google.com/scholar?q=related:7rX9IFV7DeUJ:scholar.google.com/&scioq=deeplabcut+dlc&hl=en&as_sdt=2007"
